{
    "resultsPath": "data/lwchm/siteA.nc",
    "workers": -1,
    "body": "earth",
    "resolution": "01s",
    "scanMode": "region",
    "scanRegion": [
        [
            -111.614595,
            35.593979
        ],
        [
            -111.569678,
            35.638896
        ]
    ],
    "scanTrack": null,
    "tx": [
        -111.592136,
        35.616437
    ],
    "txHeight": 10,
    "rxHeight": 2,
    "model": "lwchm",
    "lwchm": {
        "refCount": 5,
        "refAttemptPerRing": 3,
        "ringRadiusMin": 5,
        "ringRadiusMax": 300,
        "ringRadiusUncertainty": 15,
        "ringCount": 10,
        "complexRelPermittivityReal": 6.847824,
        "complexRelPermittivityRealStd": 0.007099,
        "complexRelPermittivityImag": -0.836473,
        "complexRelPermittivityImagStd": 0.001295,
        "horizontalPolarization": false,
        "fadingPaths": 1024,
        "fadingDopplerSpread": 1
    },
    "signal": "qpsk",
    "psk": {
        "data": "ZGVhZGJlZWY=",
        "symbolPeriod": 3.333333e-7,
        "fs": 3e9,
        "carrFs": 913e6,
        "transmitPower": 30
    },
    "projection": "M15c"
}